{
  "$schema": "../../agents/schemas/steps_registry.schema.json",
  "agentId": "detailer",
  "version": "1.0.0",
  "c1": "steps",
  "pathTemplate": "{c1}/{c2}/{c3}/f_{edition}_{adaptation}.md",
  "pathTemplateNoAdaptation": "{c1}/{c2}/{c3}/f_{edition}.md",
  "entryStepMapping": {
    "count:iteration": "detail"
  },
  "steps": {
    "detail": {
      "stepId": "detail",
      "name": "Detail Implementation Spec",
      "stepKind": "closure",
      "c2": "closure",
      "c3": "detail",
      "edition": "default",
      "uvVariables": [
        "issue"
      ],
      "usesStdin": false,
      "description": "Single-iteration closure: read issue body + considerer comment, compose Implementation Spec (Summary / Changes / Approach / Acceptance Criteria / Test Plan), post spec comment, emit verdict (handoff-impl | blocked). No code changes, no issue close.",
      "outputSchemaRef": {
        "file": "detailer.schema.json",
        "schema": "closure.detail"
      },
      "structuredGate": {
        "allowedIntents": [
          "closing",
          "repeat"
        ],
        "intentSchemaRef": "#/properties/next_action/properties/action",
        "intentField": "next_action.action",
        "fallbackIntent": "closing",
        "handoffFields": [
          "verdict",
          "detail_summary",
          "spec_comment_url",
          "blocked_reason"
        ]
      },
      "transitions": {
        "closing": {
          "target": null
        },
        "repeat": {
          "target": "detail"
        }
      }
    }
  }
}
